Title,Link,has_ai_ml,ai_keywords_count,bio_keywords_count,organism_mice,organism_mouse,organism_rat,organism_human,organism_cell culture,organism_drosophila,organism_elegans,organism_plant
Effects of Spaceflight on Cancellous and Cortical Bone in Proximal Femur in Growing Rats,https://www.ncbi.nlm.nih.gov/pmc/articles/PMC7907224/,False,0,3,False,False,True,False,False,False,False,False
Evidence for increased thermogenesis in female C57BL/6J mice housed aboard the international space station,https://www.ncbi.nlm.nih.gov/pmc/articles/PMC8213760/,False,0,1,True,False,False,False,False,False,False,False
Leptin and environmental temperature as determinants of bone marrow adiposity in female mice,https://www.ncbi.nlm.nih.gov/pmc/articles/PMC9582271/,False,0,1,True,False,True,False,False,False,False,False
Small changes in thermoregulation influence cancellous bone turnover balance in distal femur metaphysis in growing female mice,https://www.ncbi.nlm.nih.gov/pmc/articles/PMC10063413/,False,0,2,True,False,False,False,False,False,False,False
Bone Marrow Adipose Tissue Is Not Required for Reconstitution of the Immune System Following Irradiation in Male Mice,https://www.ncbi.nlm.nih.gov/pmc/articles/PMC10889206/,False,0,4,True,False,False,False,False,False,False,False
Simulated Microgravity Promotes Horizontal Gene Transfer of Antimicrobial Resistance Genes between Bacterial Genera in the Absence of Antibiotic Selective Pressure,https://www.ncbi.nlm.nih.gov/pmc/articles/PMC8468678/,False,0,4,False,False,False,False,False,False,False,False
Understanding the Complexities and Changes of the Astronaut Microbiome for Successful Long-Duration Space Missions,https://www.ncbi.nlm.nih.gov/pmc/articles/PMC9031868/,False,0,0,False,False,True,False,False,False,False,False
Toward sustainable space exploration: a roadmap for harnessing the power of microorganisms.,https://www.ncbi.nlm.nih.gov/pmc/articles/PMC10030976/,False,0,0,False,False,True,False,False,False,False,False
Roll maneuvers are essential for active reorientation of Caenorhabditis elegans in 3D media,https://www.ncbi.nlm.nih.gov/pmc/articles/PMC5910807/,False,0,0,False,False,False,False,False,False,True,False
Microfluidic Device for Studying Nematodes,https://www.ncbi.nlm.nih.gov/pmc/articles/PMC12021249/,False,0,0,False,False,False,False,False,False,False,False
NemaFlex: A microfluidics-based technology for standardized measurement of muscular strength of C. elegans.,https://www.ncbi.nlm.nih.gov/pmc/articles/PMC6057834/,False,0,0,False,False,False,False,False,False,True,False
"Swim exercise in Caenorhabditis elegans extends neuromuscular and gut healthspan, enhances learning ability, and protects against neurodegeneration",https://www.ncbi.nlm.nih.gov/pmc/articles/PMC6876156/,False,0,1,False,False,True,False,False,False,True,False
Molecular muscle experiment: Hardware and operational lessons for future astrobiology space experiments,https://www.ncbi.nlm.nih.gov/pmc/articles/PMC7415877/,False,0,1,False,False,True,False,False,False,False,False
Tart Cherry Increases Lifespan in Caenorhabditis elegans by Altering Metabolic Signaling Pathways,https://www.ncbi.nlm.nih.gov/pmc/articles/PMC7285199/,False,0,0,False,False,False,False,False,False,True,False
A region of UNC-89 (obscurin) lying between two protein kinase domains is a highly elastic spring required for proper sarcomere organization,https://www.ncbi.nlm.nih.gov/pmc/articles/PMC9549344/,False,0,1,False,False,False,False,False,False,False,False
NemaLife chip: a micropillar-based microfluidic culture device optimized for aging studies in crawling C. elegans,https://www.ncbi.nlm.nih.gov/pmc/articles/PMC7530743/,False,0,0,False,False,False,False,False,False,True,False
Spaceflight affects neuronal morphology and alters transcellular degradation of neuronal debris in adult Caenorhabditis elegans,https://www.ncbi.nlm.nih.gov/pmc/articles/PMC7890410/,False,0,4,False,False,False,False,False,False,True,False
Microfluidics-integrated spaceflight hardware for measuring muscle strength of Caenorhabditis elegans on the International Space Station.,https://www.ncbi.nlm.nih.gov/pmc/articles/PMC9640571/,False,0,2,False,False,True,False,False,False,True,False
A Compact Imaging Platform for Conducting C. elegans Phenotypic Assays on Earth and in Spaceflight.,https://www.ncbi.nlm.nih.gov/pmc/articles/PMC9862956/,False,0,1,False,False,False,False,False,False,True,False
Mitochondrial sulfide promotes life span and health span through distinct mechanisms in developing versus adult treated Caenorhabditis elegans.,https://www.ncbi.nlm.nih.gov/pmc/articles/PMC10410709/,False,0,0,False,False,False,False,False,False,True,False
Bisphosphonates attenuate age-related muscle decline in Caenorhabditis elegans.,https://www.ncbi.nlm.nih.gov/pmc/articles/PMC10751425/,False,0,1,False,False,False,False,False,False,True,False
Spaceflight Induces Strength Decline in Caenorhabditis elegans,https://www.ncbi.nlm.nih.gov/pmc/articles/PMC10605753/,False,0,1,False,False,False,False,False,False,True,False
Metabolic model predictions enable targeted microbiome manipulation through precision prebiotics.,https://www.ncbi.nlm.nih.gov/pmc/articles/PMC10846184/,True,1,0,False,False,False,False,False,False,False,False
Transcriptomics analysis reveals molecular alterations underpinning spaceflight dermatology.,https://www.ncbi.nlm.nih.gov/pmc/articles/PMC11166967/,False,0,1,False,False,True,False,False,False,False,False
Identification and characterization of a skin microbiome on Caenorhabditis elegans suggests environmental microbes confer cuticle protection,https://www.ncbi.nlm.nih.gov/pmc/articles/PMC11302229/,False,0,0,False,False,False,False,False,False,True,False
Protein kinase 2 of the giant sarcomeric protein UNC-89 regulates mitochondrial morphology and function,https://www.ncbi.nlm.nih.gov/pmc/articles/PMC11487192/,False,0,2,False,False,False,False,False,False,False,False
New perspectives on viable microbial communities in low-biomass cleanroom environments,https://www.ncbi.nlm.nih.gov/pmc/articles/PMC3554398/,False,0,0,False,False,False,False,False,False,False,False
Microbial existence in controlled habitats and their resistance to space conditions,https://www.ncbi.nlm.nih.gov/pmc/articles/PMC10370681/,False,0,0,False,False,False,False,False,False,False,False
Microbiomes of the dust particles collected from the International Space Station and Spacecraft assembly facilities,https://www.ncbi.nlm.nih.gov/pmc/articles/PMC4624184/,False,0,0,False,False,False,False,False,False,False,False
"Draft genome sequences of two Aspergillus fumigatus strains, isolated from the International Space Station",https://www.ncbi.nlm.nih.gov/pmc/articles/PMC4945788/,False,0,0,False,False,False,False,False,False,False,False
Characterization of Aspergillus fumigatus isolates from air and surfaces of the International Space Station.,https://www.ncbi.nlm.nih.gov/pmc/articles/PMC9116463/,False,0,0,False,False,False,False,False,False,False,False
Draft genome sequences of biosafety level 2 opportunistic pathogens isolated from the environmental surfaces of the International Space Station.,https://www.ncbi.nlm.nih.gov/pmc/articles/PMC5201052/,False,0,0,False,False,False,False,False,False,False,False
Draft Genome Sequences of Several Fungal Strains Selected for Exposure to Microgravity at the International Space Station.,https://www.ncbi.nlm.nih.gov/pmc/articles/PMC5391430/,False,0,1,False,False,False,False,False,False,False,False
Human presence impacts fungal diversity of inflated lunar/Mars analog habitat.,https://www.ncbi.nlm.nih.gov/pmc/articles/PMC5504618/,False,0,0,False,False,False,True,False,False,False,False
Whole metagenome profiles of particulates collected from the International Space Station,https://www.ncbi.nlm.nih.gov/pmc/articles/PMC5580210/,False,0,0,False,False,False,False,False,False,False,False
Microbial Characteristics of ISS Environmental Surfaces,https://www.ncbi.nlm.nih.gov/pmc/articles/PMC8421509/,False,0,0,False,False,False,False,False,False,False,False
"Draft Genome Sequences from a Novel Clade of Bacillus cereus Sensu Lato Strains, Isolated from the International Space Station.",https://www.ncbi.nlm.nih.gov/pmc/articles/PMC5552977/,False,0,0,False,False,False,False,False,False,False,False
Draft Genome Sequences of Acinetobacter and Bacillus Strains Isolated from Spacecraft-Associated Surfaces,https://www.ncbi.nlm.nih.gov/pmc/articles/PMC5805884/,False,0,0,False,False,False,False,False,False,False,False
KatharoSeq enables high-throughput microbiome analysis from low-biomass samples,https://www.ncbi.nlm.nih.gov/pmc/articles/PMC5864415/,False,0,0,False,False,False,False,False,False,False,False
Draft genome sequence of a clinical isolate of Fusarium fujikuroi isolated from a male patient with acute myeloid leukemia.,https://www.ncbi.nlm.nih.gov/pmc/articles/PMC6013642/,False,0,0,False,False,False,False,False,False,False,False
"Draft Genome Sequence of Solibacillus kalamii, Isolated from an Air Filter Aboard the International Space Station",https://www.ncbi.nlm.nih.gov/pmc/articles/PMC5578834/,False,0,0,False,False,False,False,False,False,False,False
Detection of antimicrobial resistance genes associated with the International Space Station environmental surfaces,https://www.ncbi.nlm.nih.gov/pmc/articles/PMC9241228/,False,0,1,False,False,False,False,False,False,False,False
Draft genome sequences of two Fusarium oxysporum isolates cultured from infected Zinnia hybrida plants grown on the International Space Station.,https://www.ncbi.nlm.nih.gov/pmc/articles/PMC5958250/,False,0,0,False,False,False,False,False,False,False,True
Characterization of Aspergillus niger Isolated from the International Space Station,https://www.ncbi.nlm.nih.gov/pmc/articles/PMC7326050/,False,0,0,False,False,False,False,False,False,False,False
Multi-drug resistant Enterobacter bugandensis species isolated from the International Space Station and comparative genomic analyses with human pathogenic strains,https://www.ncbi.nlm.nih.gov/pmc/articles/PMC6251167/,False,0,0,False,False,True,True,False,False,False,False
Succession and persistence of microbial communities and antimicrobial resistance genes associated with International Space Station environmental surfaces,https://www.ncbi.nlm.nih.gov/pmc/articles/PMC6280456/,False,0,1,False,False,False,False,False,False,False,False
"International Space Station conditions alter genomics, proteomics, and metabolomics in Aspergillus nidulans.",https://www.ncbi.nlm.nih.gov/pmc/articles/PMC9098231/,False,0,0,False,False,False,False,False,False,False,False
Proteomic characterization of Aspergillus fumigatus isolated from air and surfaces of the International Space Station.,https://www.ncbi.nlm.nih.gov/pmc/articles/PMC9116463/,False,0,0,False,False,False,False,False,False,False,False
Genomic Characterization and Virulence Potential of Two Fusarium oxysporum Isolates Cultured from the International Space Station,https://www.ncbi.nlm.nih.gov/pmc/articles/PMC6426649/,False,0,0,False,False,False,False,False,False,False,False
Characterization of the total and viable bacterial and fungal communities associated with the International Space Station surfaces.,https://www.ncbi.nlm.nih.gov/pmc/articles/PMC6452512/,False,0,0,False,False,False,False,False,False,False,False
Proteomic and Metabolomic Characteristics of Extremophilic Fungi Under Simulated Mars Conditions.,https://www.ncbi.nlm.nih.gov/pmc/articles/PMC6529585/,False,0,0,False,False,False,False,False,False,False,False
MetaMiner: A Scalable Peptidogenomics Approach for Discovery of Ribosomal Peptide Natural Products with Blind Modifications from Microbial Communities,https://www.ncbi.nlm.nih.gov/pmc/articles/PMC6952069/,False,0,0,False,False,False,False,False,False,False,False
Draft Genome Sequences of Sphingomonas Species Associated with the International Space Station,https://www.ncbi.nlm.nih.gov/pmc/articles/PMC7303416/,False,0,0,False,False,False,False,False,False,False,False
Draft Genome Sequences of Tremellomycetes Strains Isolated from the International Space Station,https://www.ncbi.nlm.nih.gov/pmc/articles/PMC7317102/,False,0,0,False,False,False,False,False,False,False,False
Draft Genome Sequences of Rhodotorula mucilaginosa Strains Isolated from the International Space Station,https://www.ncbi.nlm.nih.gov/pmc/articles/PMC7393961/,False,0,0,False,False,False,False,False,False,False,False
Draft Genome Sequences of Enterobacteriales Strains Isolated from the International Space Station,https://www.ncbi.nlm.nih.gov/pmc/articles/PMC7484075/,False,0,0,False,False,False,False,False,False,False,False
Draft Genome Sequences of Lactobacillales Isolated from the International Space Station,https://www.ncbi.nlm.nih.gov/pmc/articles/PMC7516158/,False,0,0,False,False,False,False,False,False,False,False
Draft Genome Sequences of Klebsiella Species Isolated from the International Space Station,https://www.ncbi.nlm.nih.gov/pmc/articles/PMC7561690/,False,0,0,False,False,False,False,False,False,False,False
Draft Genome Sequences of Bacillaceae Strains Isolated from the International Space Station.,https://www.ncbi.nlm.nih.gov/pmc/articles/PMC7595942/,False,0,0,False,False,False,False,False,False,False,False
Assessing the risk of transfer of microorganisms at the International Space Station due to cargo delivery by commercial resupply vehicles,https://www.ncbi.nlm.nih.gov/pmc/articles/PMC7677455/,False,0,0,False,False,False,False,False,False,False,False
"Methylobacterium ajmalii sp. nov., isolated from the International Space Station",https://www.ncbi.nlm.nih.gov/pmc/articles/PMC8005752/,False,0,0,False,False,False,False,False,False,False,False
Draft Genome Sequences of Aspergillus and Penicillium Species Isolated from the International Space Station and Crew Resupply Vehicle Capsule,https://www.ncbi.nlm.nih.gov/pmc/articles/PMC8104057/,False,0,0,False,False,False,False,False,False,False,False
Advances in Space Microbiology,https://www.ncbi.nlm.nih.gov/pmc/articles/PMC12034939/,False,0,0,False,False,False,False,False,False,False,False
Effects of simulated microgravity on the proteome and secretome of the polyextremotolerant black fungus Knufia chersonesos.,https://www.ncbi.nlm.nih.gov/pmc/articles/PMC8012687/,False,0,1,False,False,False,False,False,False,False,False
Draft Genome Sequences of Various Bacterial Phyla Isolated from the International Space Station,https://www.ncbi.nlm.nih.gov/pmc/articles/PMC8086211/,False,0,0,False,False,False,False,False,False,False,False
Evaluating the lettuce metatranscriptome with MinION sequencing for future spaceflight food production applications,https://www.ncbi.nlm.nih.gov/pmc/articles/PMC8211661/,False,0,1,False,False,False,False,False,False,False,False
Investigation of Spaceflight Induced Changes to Astronaut Microbiomes,https://www.ncbi.nlm.nih.gov/pmc/articles/PMC11988970/,False,0,1,False,False,False,False,False,False,False,False
Genomic Characterization of Potential Plant Growth-Promoting Features of Sphingomonas Strains Isolated from the International Space Station,https://www.ncbi.nlm.nih.gov/pmc/articles/PMC8754149/,False,0,0,False,False,False,False,False,False,False,True
"Genomic Characterization of the Titan-like Cell Producing Naganishia tulchinskyi, the First Novel Eukaryote Isolated from the International Space Station",https://www.ncbi.nlm.nih.gov/pmc/articles/PMC8875396/,False,0,1,False,False,False,False,False,False,False,False
Metabolic modeling of the International Space Station microbiome reveals key microbial interactions.,https://www.ncbi.nlm.nih.gov/pmc/articles/PMC9258157/,True,1,0,False,False,False,False,False,False,False,False
"Microbial Burden Estimation of Food Items, Built Environments, and the International Space Station Using Film Media",https://www.ncbi.nlm.nih.gov/pmc/articles/PMC9503880/,False,0,0,False,False,False,False,False,False,False,False
Multidrug-resistant Acinetobacter pittii is adapting to and exhibiting potential succession aboard the International Space Station.,https://www.ncbi.nlm.nih.gov/pmc/articles/PMC9743659/,False,0,0,False,False,False,False,False,False,False,False
Characterization of metagenome-assembled genomes from the International Space Station.,https://www.ncbi.nlm.nih.gov/pmc/articles/PMC10233975/,False,0,0,False,False,False,False,False,False,False,False
Comparative genomic analysis of Cohnella hashimotonis sp. nov. isolated from the International Space Station,https://www.ncbi.nlm.nih.gov/pmc/articles/PMC10308117/,False,0,0,False,False,True,False,False,False,False,False
Genomic analysis reveals the presence of emerging pathogenic Klebsiella lineages aboard the International Space Station,https://www.ncbi.nlm.nih.gov/pmc/articles/PMC10715203/,False,0,0,False,False,False,False,False,False,False,False
"Phylogenomics, phenotypic, and functional traits of five novel (Earth-derived) bacterial species isolated from the International Space Station and their prevalence in metagenomes",https://www.ncbi.nlm.nih.gov/pmc/articles/PMC10628120/,False,0,0,False,False,False,False,False,False,False,False
"Genomic, functional, and metabolic enhancements in multidrug-resistant Enterobacter bugandensis facilitating its persistence and succession in the International Space Station",https://www.ncbi.nlm.nih.gov/pmc/articles/PMC10960378/,False,0,0,False,False,False,False,False,False,False,False
"Phylogenomics, phenotypic, and functional traits of five novel (Earth-derived) bacterial species isolated from the International Space Station and their prevalence in metagenomes",https://www.ncbi.nlm.nih.gov/pmc/articles/PMC10628120/,False,0,0,False,False,False,False,False,False,False,False
Adaptation to space conditions of novel bacterial species isolated from the International Space Station revealed by functional gene annotations and comparative genome analysis,https://www.ncbi.nlm.nih.gov/pmc/articles/PMC11451251/,False,0,1,False,False,True,False,False,False,False,False
Spatial regulation of a common precursor from two distinct genes generates metabolite diversity,https://www.ncbi.nlm.nih.gov/pmc/articles/PMC5523082/,False,0,2,False,False,True,False,False,False,False,False
Recent advances in the genome mining of Aspergillus secondary metabolites (covering 2012–2018).,https://www.ncbi.nlm.nih.gov/pmc/articles/PMC6590338/,False,0,0,False,False,False,False,False,False,False,False
Cortical thinning and structural bone changes in non-human primates after single-fraction whole-chest irradiation.,https://www.ncbi.nlm.nih.gov/pmc/articles/PMC6036641/,False,0,2,False,False,False,True,False,False,False,False
Knee and Hip Joint Cartilage Damage from Combined Spaceflight Hazards of Low-Dose Radiation Less than 1 Gy and Prolonged Hindlimb Unloading.,https://www.ncbi.nlm.nih.gov/pmc/articles/PMC6599637/,False,0,2,False,False,False,False,False,False,False,False
The individual and combined effects of spaceflight radiation and microgravity on biologic systems and functional outcomes,https://www.ncbi.nlm.nih.gov/pmc/articles/PMC8274610/,False,0,3,False,False,False,False,False,False,False,False
Spaceflight and hind limb unloading induces an arthritic phenotype in knee articular cartilage and menisci of rodents,https://www.ncbi.nlm.nih.gov/pmc/articles/PMC8131644/,False,0,1,False,False,False,False,False,False,False,False
αKlotho decreases after reduced weight-bearing from both spaceflight and hindlimb unloading,https://www.ncbi.nlm.nih.gov/pmc/articles/PMC9163032/,False,0,1,False,False,False,False,False,False,False,False
Prolonged exposure to particulate chromate inhibits RAD51 nuclear import mediator proteins.,https://www.ncbi.nlm.nih.gov/pmc/articles/PMC5568470/,False,0,1,False,False,False,False,False,False,False,False
"Transcriptomics, NF-κB Pathway, and Their Potential Spaceflight-Related Health Consequences.",https://www.ncbi.nlm.nih.gov/pmc/articles/PMC5485990/,False,0,1,False,False,False,False,False,False,False,False
Interplay of space radiation and microgravity in DNA damage and DNA damage response.,https://www.ncbi.nlm.nih.gov/pmc/articles/PMC5460239/,False,0,2,False,False,False,False,False,False,False,False
"Synergistic Effects of Weightlessness, Isoproterenol, and Radiation on DNA Damage Response and Cytokine Production in Immune Cells",https://www.ncbi.nlm.nih.gov/pmc/articles/PMC6275019/,False,0,3,False,False,False,False,False,False,False,False
Transcriptome and proteome responses in RNAlater preserved tissue of Arabidopsis thaliana.,https://www.ncbi.nlm.nih.gov/pmc/articles/PMC5397022/,False,0,1,False,False,False,False,False,False,False,False
Spaceflight induces novel regulatory responses in Arabidopsis seedling as revealed by combined proteomic and transcriptomic analyses.,https://www.ncbi.nlm.nih.gov/pmc/articles/PMC7251690/,False,0,1,False,False,False,False,False,False,False,False
Mitigation and use of biofilms in space for the benefit of human space exploration,https://www.ncbi.nlm.nih.gov/pmc/articles/PMC10284894/,False,0,0,False,False,True,True,False,False,False,False
Toward sustainable space exploration: A roadmap for harnessing the power of microorganisms.,https://www.ncbi.nlm.nih.gov/pmc/articles/PMC10030976/,False,0,0,False,False,True,False,False,False,False,False
Longitudinal characterization of multispecies microbial populations recovered from spaceflight potable water,https://www.ncbi.nlm.nih.gov/pmc/articles/PMC8421509/,False,0,1,False,False,False,False,False,False,False,False
Designing a Novel Monitoring Approach for the Effects of Space Travel on Astronauts’ Health,https://www.ncbi.nlm.nih.gov/pmc/articles/PMC9964234/,False,0,0,False,False,False,False,False,False,False,False
"Draft genome sequence of Sphingomonas paucimobilis strain Sph5, isolated from tap water filtration membrane",https://www.ncbi.nlm.nih.gov/pmc/articles/PMC10793275/,False,0,0,False,False,True,False,False,False,False,False
Overexpression of CupB5 activates alginate overproduction in Pseudomonas aeruginosa by a novel AlgW-dependent mechanism,https://www.ncbi.nlm.nih.gov/pmc/articles/PMC4116675/,False,0,0,False,False,False,False,False,False,False,False
Burn injury-associated MHCII(+) immune cell accumulation around lymphatic vessels of the mesentery and increased lymphatic endothelial permeability are blocked by doxycycline treatment.,https://www.ncbi.nlm.nih.gov/pmc/articles/PMC5810432/,False,0,2,False,False,False,False,False,False,False,False
CubeSats for microbiology and astrobiology research,https://www.ncbi.nlm.nih.gov/pmc/articles/PMC10261121/,False,0,0,False,False,False,False,False,False,False,False
In situ resource utilisation: The potential for space biomining,https://www.ncbi.nlm.nih.gov/pmc/articles/PMC8739323/,False,0,0,False,False,False,False,False,False,False,False
The smallest space miners: Principles of space biomining,https://www.ncbi.nlm.nih.gov/pmc/articles/PMC8739323/,False,0,0,False,False,False,False,False,False,False,False
"Simulated micro-, lunar, and Martian gravities on Earth—effects on Escherichia coli growth, phenotype, and sensitivity to antibiotics.",https://www.ncbi.nlm.nih.gov/pmc/articles/PMC9502502/,False,0,0,False,False,False,False,False,False,False,False
Biofilm formation of Pseudomonas aeruginosa in spaceflight is minimized on lubricant impregnated surfaces.,https://www.ncbi.nlm.nih.gov/pmc/articles/PMC10432549/,False,0,1,False,False,False,False,False,False,False,False
Competitive Growth Assay of Mutagenized Chlamydomonas reinhardtii Compatible With the International Space Station Veggie Plant Growth Chamber.,https://www.ncbi.nlm.nih.gov/pmc/articles/PMC7261848/,False,0,0,False,False,False,False,False,False,False,True
Spatial Characterization of Microbial Communities on Multi-Species Leafy Greens Grown Simultaneously in the Vegetable Production Systems on the International Space Station,https://www.ncbi.nlm.nih.gov/pmc/articles/PMC8537831/,False,0,0,False,False,False,False,False,False,False,False
Response of Arabidopsis thaliana and Mizuna mustard seeds to simulated space radiation exposures.,https://www.ncbi.nlm.nih.gov/pmc/articles/PMC8879990/,False,0,1,False,False,False,False,False,False,False,False
Editorial: Revisiting the limits of plant life - plant adaptations to extreme terrestrial environments relating to astrobiology and space biology.,https://www.ncbi.nlm.nih.gov/pmc/articles/PMC10472590/,False,0,0,False,False,False,False,False,False,False,True
Metagenomic interrogation of urban Superfund site reveals antimicrobial resistance reservoir and bioremediation potential.,https://www.ncbi.nlm.nih.gov/pmc/articles/PMC11999716/,False,0,0,False,False,False,False,False,False,False,False
"In situ monitoring of barrier function on-chip via automated, non-invasive luminescence sensing.",https://www.ncbi.nlm.nih.gov/pmc/articles/PMC11969330/,False,0,0,False,False,False,False,False,False,False,False
37-day microgravity exposure in 16-week female C57BL/6J mice is associated with bone loss specific to weight-bearing skeletal sites.,https://www.ncbi.nlm.nih.gov/pmc/articles/PMC11940681/,False,0,2,True,False,False,False,False,False,False,False
Effects of Space Flight on Inflammasome Activation in the Brain of Mice.,https://www.ncbi.nlm.nih.gov/pmc/articles/PMC11941215/,False,0,1,True,False,False,False,False,False,False,False
Immunization induces inflammation in the mouse heart during spaceflight.,https://www.ncbi.nlm.nih.gov/pmc/articles/PMC11892206/,False,0,1,False,True,False,False,False,False,False,False
Analyzing the relationship between gene expression and phenotype in space-flown mice using a causal inference machine learning ensemble.,https://www.ncbi.nlm.nih.gov/pmc/articles/PMC11748630/,True,1,1,True,False,False,False,False,False,False,False
Sex-specific cardiovascular adaptations to simulated microgravity in Sprague-Dawley rats,https://www.ncbi.nlm.nih.gov/pmc/articles/PMC11659408/,False,0,1,False,False,True,False,False,False,False,False
