Title,Link,has_ai_ml,ai_keywords_count,bio_keywords_count,organism_mice,organism_mouse,organism_rat,organism_human,organism_cell culture,organism_drosophila,organism_elegans,organism_plant
"Microbial tracking-2, a metagenomics analysis of bacteria and fungi onboard the International Space Station.",https://www.ncbi.nlm.nih.gov/pmc/articles/PMC9241228/,False,0,0,False,False,False,False,False,False,False,False
Detection of Target Genes for Drug Repurposing to Treat Skeletal Muscle Atrophy in Mice Flown in Spaceflight,https://www.ncbi.nlm.nih.gov/pmc/articles/PMC8953707/,False,0,3,True,False,False,False,False,False,False,False
Release of CD36-associated cell-free mitochondrial DNA and RNA as a hallmark of space environment response,https://www.ncbi.nlm.nih.gov/pmc/articles/PMC11166646/,False,0,1,False,False,False,False,False,False,False,False
Increasing the number of unloading/reambulation cycles does not adversely impac body composition and lumbar bone mineral density but reduces tissue sensitivity,https://www.ncbi.nlm.nih.gov/pmc/articles/PMC3747666/,False,0,2,False,False,False,False,False,False,False,False
Bone shaft bending strength index is unaffected by exercise and unloading in mice,https://www.ncbi.nlm.nih.gov/pmc/articles/PMC4337661/,False,0,1,True,False,False,False,False,False,False,False
Focal enhancement of the skeleton to exercise correlates to mesenchymal stem cell responsivity rather than peak external forces.,https://www.ncbi.nlm.nih.gov/pmc/articles/PMC4631774/,False,0,1,False,False,True,False,False,False,False,False
"Cytoskeletal configuration modulates mechanically induced changes in mesenchymal stem cell osteogenesis, morphology, and stiffness.",https://www.ncbi.nlm.nih.gov/pmc/articles/PMC5052530/,False,0,2,False,False,True,False,False,False,False,False
Genetic and tissue level muscle-bone interactions during unloading and reambulation.,https://www.ncbi.nlm.nih.gov/pmc/articles/PMC5114340/,False,0,4,False,False,False,False,False,False,False,False
Osteocyte apoptosis caused by hindlimb unloading is required to trigger osteocyte RANKL production and subsequent resorption of cortical and trabecular bone in mice femurs.,https://www.ncbi.nlm.nih.gov/pmc/articles/PMC5488280/,False,0,1,True,False,False,False,False,False,False,False
Differential Single Cell Responses of Embryonic Stem Cells Versus Embryoid Bodies to Gravity Mechanostimulation,https://www.ncbi.nlm.nih.gov/pmc/articles/PMC9293686/,False,0,2,False,False,False,False,False,False,False,False
Macrophages inhibit Aspergillus fumigatus germination and neutrophil-mediated fungal killing.,https://www.ncbi.nlm.nih.gov/pmc/articles/PMC6091969/,False,0,0,False,False,False,False,False,False,False,False
Contributions of spore secondary metabolites to UV-C protection and virulence vary in different Aspergillus fumigatus strains,https://www.ncbi.nlm.nih.gov/pmc/articles/PMC7029147/,False,0,0,False,False,False,False,False,False,False,False
Regulation of hemocytes in Drosophila requires dappled cytochrome b5.,https://www.ncbi.nlm.nih.gov/pmc/articles/PMC3092937/,False,0,0,False,False,False,False,False,True,False,False
A novel phototropic response to red light is revealed in microgravity.,https://www.ncbi.nlm.nih.gov/pmc/articles/PMC5748516/,False,0,1,False,False,False,False,False,False,False,False
Plant cell proliferation and growth are altered by microgravity conditions in spaceflight.,https://www.ncbi.nlm.nih.gov/pmc/articles/PMC9287483/,False,0,3,False,False,True,False,False,False,False,True
Phototropism of Arabidopsis thaliana in microgravity and fractional gravity on the International Space Station.,https://www.ncbi.nlm.nih.gov/pmc/articles/PMC5748516/,False,0,1,False,False,False,False,False,False,False,False
Light and gravity signals synergize in modulating plant development,https://www.ncbi.nlm.nih.gov/pmc/articles/PMC4211383/,False,0,0,False,False,False,False,False,False,False,True
A novel blue-light phototropic response is revealed in roots of Arabidopsis thaliana in microgravity.,https://www.ncbi.nlm.nih.gov/pmc/articles/PMC5748516/,False,0,1,False,False,False,False,False,False,False,False
Comparative transcriptomics indicate changes in cell wall organization and stress response in seedlings during spaceflight,https://www.ncbi.nlm.nih.gov/pmc/articles/PMC5821596/,False,0,3,False,False,True,False,False,False,False,False
RNAseq analysis of the response of Arabidopsis thaliana to fractional gravity under blue-light stimulation during spaceflight,https://www.ncbi.nlm.nih.gov/pmc/articles/PMC6889863/,False,0,1,False,False,False,False,False,False,False,False
Comparison of Microgravity Analogs to Spaceflight in Studies of Plant Growth and Development,https://www.ncbi.nlm.nih.gov/pmc/articles/PMC6908503/,False,0,2,False,False,False,False,False,False,False,True
The importance of Earth reference controls in spaceflight-omics research: Characterization of nucleolin mutants from the Seedling Growth experiments,https://www.ncbi.nlm.nih.gov/pmc/articles/PMC7607443/,False,0,1,False,False,False,False,False,False,False,False
Conducting plant experiments in space and on the Moon,https://www.ncbi.nlm.nih.gov/pmc/articles/PMC10764921/,False,0,0,False,False,False,False,False,False,False,True
Red light enhances plant adaptation to spaceflight and Mars g-levels.,https://www.ncbi.nlm.nih.gov/pmc/articles/PMC9605285/,False,0,1,False,False,False,False,False,False,False,True
EUK-134 ameliorates nNOSµ translocation and skeletal muscle fiber atrophy during short-term mechanical unloading.,https://www.ncbi.nlm.nih.gov/pmc/articles/PMC3962621/,False,0,1,False,False,True,False,False,False,False,False
MnSOD Overexpression Reduces Fibrosis and Pro-Apoptotic Signaling in the Aging Mouse Heart,https://www.ncbi.nlm.nih.gov/pmc/articles/PMC4462657/,False,0,0,False,True,False,False,False,False,False,False
Lifelong wheel running exercise and mild caloric restriction attenuate nuclear EndoG in the aging plantaris muscle.,https://www.ncbi.nlm.nih.gov/pmc/articles/PMC5026643/,False,0,1,False,False,False,False,False,False,False,True
Age-related alterations in the sarcolemmal environment are attenuated by lifelong caloric restriction and voluntary exercise.,https://www.ncbi.nlm.nih.gov/pmc/articles/PMC5026642/,False,0,0,False,False,True,False,False,False,False,False
"The impact of SRT2104 on skeletal muscle mitochondrial function, redox biology, and loss of muscle mass in hindlimb unloaded rats.",https://www.ncbi.nlm.nih.gov/pmc/articles/PMC10342025/,False,0,2,False,False,True,False,False,False,False,False
Bioreactor development for skeletal muscle hypertrophy and atrophy by manipulating uniaxial cyclic strain: Proof of concept.,https://www.ncbi.nlm.nih.gov/pmc/articles/PMC11167039/,False,0,1,False,False,False,False,False,False,False,False
Genomic and phenotypic characterization of Burkholderia isolates from the potable water system of the International Space Station,https://www.ncbi.nlm.nih.gov/pmc/articles/PMC10020673/,False,0,0,False,False,False,False,False,False,False,False
CAMDLES: CFD-DEM Simulation of Microbial Communities in Spaceflight and Artificial Microgravity,https://www.ncbi.nlm.nih.gov/pmc/articles/PMC9144607/,False,0,2,False,False,False,False,False,False,False,False
Hardware validation of the Advanced Plant Habitat on ISS: Canopy photosynthesis in reduced gravity.,https://www.ncbi.nlm.nih.gov/pmc/articles/PMC7314936/,False,0,0,False,False,False,False,False,False,False,True
Trimeric structure of (+)-pinoresinol-forming dirigent protein at 1.95 A resolution with three isolated active sites.,https://www.ncbi.nlm.nih.gov/pmc/articles/PMC4340379/,False,0,1,False,False,False,False,False,False,False,False
Reduced Arogenate Dehydratase Expression: Ramifications for Photosynthesis and Metabolism,https://www.ncbi.nlm.nih.gov/pmc/articles/PMC5933128/,False,0,1,False,False,True,False,False,False,False,False
New insights into lignification via network and multi-omics analyses of arogenate dehydratase knock-out mutants in Arabidopsis thaliana,https://www.ncbi.nlm.nih.gov/pmc/articles/PMC8185232/,False,0,0,False,False,True,False,False,False,False,False
Functional consequences of radiation-induced oxidative stress in cultured neural stem cells and the brain exposed to charged particle irradiation,https://www.ncbi.nlm.nih.gov/pmc/articles/PMC3936501/,False,0,5,False,False,False,False,False,False,False,False
Exploration of space to achieve scientific breakthroughs,https://www.ncbi.nlm.nih.gov/pmc/articles/PMC11998595/,False,0,0,False,False,True,False,False,False,False,False
Network Analysis of Gene Transcriptions of Arabidopsis thaliana in Spaceflight Microgravity.,https://www.ncbi.nlm.nih.gov/pmc/articles/PMC7996555/,False,0,3,False,False,False,False,False,False,False,False
Detection of Genes in Arabidopsis thaliana L. Responding to DNA Damage from Radiation and Other Stressors in Spaceflight,https://www.ncbi.nlm.nih.gov/pmc/articles/PMC8234954/,False,0,4,False,False,False,False,False,False,False,False
"The Effect of spaceflight on mouse olfactory bulb volume, neurogenesis, and cell death indicates the protective effect of novel environment.",https://www.ncbi.nlm.nih.gov/pmc/articles/PMC4152162/,False,0,3,False,True,False,False,False,False,False,False
"Effects of low-dose rate γ-irradiation combined with simulated microgravity on markers of oxidative stress, DNA methylation potential, and remodeling in the mouse heart",https://www.ncbi.nlm.nih.gov/pmc/articles/PMC5498037/,True,1,3,False,True,True,False,False,False,False,False
Characterization of mouse ocular response to a 35-day spaceflight mission: Evidence of blood-retinal barrier disruption and ocular adaptations.,https://www.ncbi.nlm.nih.gov/pmc/articles/PMC6547757/,False,0,1,False,True,False,False,False,False,False,False
Mice Exposed to Combined Chronic Low-Dose Irradiation and Modeled Microgravity Develop Long-Term Neurological Sequelae.,https://www.ncbi.nlm.nih.gov/pmc/articles/PMC6747492/,False,0,2,True,False,False,False,False,False,False,False
"Spaceflight influences gene expression, photoreceptor integrity, and oxidative stress-related damage in the murine retina.",https://www.ncbi.nlm.nih.gov/pmc/articles/PMC6746706/,False,0,3,False,False,False,False,False,False,False,False
Evaluating ocular response in the retina and optic nerve head after single and fractionated high-energy protons,https://www.ncbi.nlm.nih.gov/pmc/articles/PMC8400407/,False,0,0,False,False,False,False,False,False,False,False
Characterization of gene expression profiles in the mouse brain after 35 days of spaceflight mission.,https://www.ncbi.nlm.nih.gov/pmc/articles/PMC9365836/,False,0,3,False,True,False,False,False,False,False,False
A multi-omics longitudinal study of the murine retinal response to chronic low-dose irradiation and simulated microgravity.,https://www.ncbi.nlm.nih.gov/pmc/articles/PMC9547011/,False,0,2,False,False,False,False,False,False,False,False
Evidence of spaceflight-induced adverse effects on photoreceptors and retinal function in the mouse eye.,https://www.ncbi.nlm.nih.gov/pmc/articles/PMC10138634/,False,0,1,False,True,False,False,False,False,False,False
Effects of spaceflight on the brain,https://www.ncbi.nlm.nih.gov/pmc/articles/PMC12031868/,False,0,2,False,False,False,False,False,False,False,False
Routine omics collection is a golden opportunity for European human research in space and analog environments.,https://www.ncbi.nlm.nih.gov/pmc/articles/PMC9583032/,False,0,0,False,False,False,True,False,False,False,False
Spatial omics technologies at multimodal and single cell/subcellular level.,https://www.ncbi.nlm.nih.gov/pmc/articles/PMC9746133/,False,0,2,False,False,False,False,False,False,False,False
Genomic characterization and radiation tolerance of Naganishia kalamii sp. nov. and Cystobasidium onofrii sp. nov. from Mars 2020 mission assembly facilities.,https://www.ncbi.nlm.nih.gov/pmc/articles/PMC10422843/,False,0,1,False,False,False,False,False,False,False,False
"Genome and clonal hematopoiesis stability contrasts with immune, cfDNA, mitochondrial, and telomere length changes during short duration spaceflight",https://www.ncbi.nlm.nih.gov/pmc/articles/PMC11022651/,False,0,2,False,False,True,False,False,False,False,False
Inspiration4 data access through the NASA Open Science Data Repository,https://www.ncbi.nlm.nih.gov/pmc/articles/PMC11094041/,False,0,0,False,False,True,False,False,False,False,False
Molecular and physiologic changes in the SpaceX Inspiration4 civilian crew,https://www.ncbi.nlm.nih.gov/pmc/articles/PMC11357997/,False,0,0,False,False,True,False,False,False,False,False
Telomeric RNA (TERRA) increases in response to spaceflight and high-altitude climbing,https://www.ncbi.nlm.nih.gov/pmc/articles/PMC11167063/,False,0,1,False,False,False,False,False,False,False,False
Spatial multi-omics of human skin reveals KRAS and inflammatory responses to spaceflight,https://www.ncbi.nlm.nih.gov/pmc/articles/PMC11166909/,False,0,1,False,False,False,True,False,False,False,False
Longitudinal multi-omics analysis of host microbiome architecture and immune responses during short-term spaceflight,https://www.ncbi.nlm.nih.gov/pmc/articles/PMC11222149/,False,0,2,False,False,False,False,False,False,False,False
Spatiotemporal expression and control of haemoglobin in space,https://www.ncbi.nlm.nih.gov/pmc/articles/PMC11166948/,False,0,0,False,False,False,False,False,False,False,False
"Single-cell multi-ome and immune profiles of the Inspiration4 crew reveal conserved, cell-type, and sex-specific responses to spaceflight",https://www.ncbi.nlm.nih.gov/pmc/articles/PMC11166952/,False,0,4,False,False,True,False,False,False,False,False
Single-cell analysis identifies conserved features of immune dysfunction in simulated microgravity and spaceflight,https://www.ncbi.nlm.nih.gov/pmc/articles/PMC11166937/,False,0,4,False,False,False,False,False,False,False,False
The Space Omics and Medical Atlas (SOMA) and international astronaut biobank,https://www.ncbi.nlm.nih.gov/pmc/articles/PMC11357981/,False,0,0,False,False,False,False,False,False,False,False
"Secretome profiling reveals acute changes in oxidative stress, brain homeostasis, and coagulation following short-duration spaceflight",https://www.ncbi.nlm.nih.gov/pmc/articles/PMC11166969/,False,0,3,False,False,True,False,False,False,False,False
Astronaut omics and the impact of space on the human body at scale,https://www.ncbi.nlm.nih.gov/pmc/articles/PMC11166943/,False,0,0,False,False,False,True,False,False,False,False
Transcriptomics analysis reveals molecular alterations underpinning spaceflight dermatology.,https://www.ncbi.nlm.nih.gov/pmc/articles/PMC11166967/,False,0,1,False,False,True,False,False,False,False,False
"Cosmic kidney disease: an integrated pan-omic, physiological and morphological study into spaceflight-induced renal dysfunction",https://www.ncbi.nlm.nih.gov/pmc/articles/PMC11167060/,False,0,1,False,False,True,False,False,False,False,False
Spaceflight induces changes in gene expression profiles linked to insulin and estrogen,https://www.ncbi.nlm.nih.gov/pmc/articles/PMC11166981/,False,0,2,False,False,False,False,False,False,False,False
Protective alleles and precision healthcare in crewed spaceflight,https://www.ncbi.nlm.nih.gov/pmc/articles/PMC11263583/,False,0,1,False,False,False,False,False,False,False,False
To boldly go where no microRNAs have gone before: Spaceflight impact on risk for small-for-gestational-age infants,https://www.ncbi.nlm.nih.gov/pmc/articles/PMC11484870/,False,0,1,False,False,False,False,False,False,False,False
Growth chambers on the International Space Station for large plants,https://www.ncbi.nlm.nih.gov/pmc/articles/PMC10780891/,False,0,0,False,False,False,False,False,False,False,True
Microbiological and nutritional analysis of lettuce crops grown on the International Space Station,https://www.ncbi.nlm.nih.gov/pmc/articles/PMC7067979/,False,0,0,False,False,False,False,False,False,False,False
Natural variation in the expression of ORGANIC CATION TRANSPORTER 1 affects root length responses to cadaverine in Arabidopsis.,https://www.ncbi.nlm.nih.gov/pmc/articles/PMC4321547/,False,0,0,False,False,False,False,False,False,False,False
Auxin: Shape matters.,https://www.ncbi.nlm.nih.gov/pmc/articles/PMC6710492/,False,0,0,False,False,False,False,False,False,False,False
Gravity signaling in flowering plant roots,https://www.ncbi.nlm.nih.gov/pmc/articles/PMC12008199/,False,0,0,False,False,False,False,False,False,False,True
Cadaverine regulates biotin synthesis to modulate primary root growth in Arabidopsis,https://www.ncbi.nlm.nih.gov/pmc/articles/PMC8518694/,False,0,0,False,False,False,False,False,False,False,False
Low-speed clinorotation of Brachypodium distachyon and Arabidopsis thaliana seedlings triggers root tip curvatures that are reminiscent of gravitropism.,https://www.ncbi.nlm.nih.gov/pmc/articles/PMC9861679/,False,0,0,False,False,False,False,False,False,False,False
New device for high-throughput viability screening of flow biofilms,https://www.ncbi.nlm.nih.gov/pmc/articles/PMC2897429/,False,0,0,False,False,False,False,False,False,False,False
Sigma S-dependent antioxidant defense protects stationary-phase Escherichia coli against the bactericidal antibiotic gentamicin,https://www.ncbi.nlm.nih.gov/pmc/articles/PMC4187989/,False,0,0,False,False,False,False,False,False,False,False
Plasma membrane disruption (PMD) formation and repair in mechanosensitive tissues,https://www.ncbi.nlm.nih.gov/pmc/articles/PMC8217198/,False,0,1,False,False,False,False,False,False,False,False
Microgravity alters the expression of salivary proteins,https://www.ncbi.nlm.nih.gov/pmc/articles/PMC6981245/,False,0,2,False,False,False,False,False,False,False,False
Salivary Gland Protein Expression after Bion-M1 and Space Shuttle STS-135 Missions,https://www.ncbi.nlm.nih.gov/pmc/articles/PMC6981245/,False,0,1,False,False,False,False,False,False,False,False
Response of the mouse sublingual gland to spaceflight.,https://www.ncbi.nlm.nih.gov/pmc/articles/PMC6131065/,False,0,1,False,True,False,False,False,False,False,False
Effects of spaceflight on the mouse submandibular gland,https://www.ncbi.nlm.nih.gov/pmc/articles/PMC11233762/,False,0,1,False,True,False,False,False,False,False,False
"Reactivation of Latent Epstein-Barr Virus: A Comparison after Exposure to Gamma, Proton, Carbon, and Iron Radiation",https://www.ncbi.nlm.nih.gov/pmc/articles/PMC6213004/,False,0,1,False,False,False,False,False,False,False,False
The influence of spaceflight on the astronaut salivary microbiome and the search for a microbiome biomarker for viral reactivation,https://www.ncbi.nlm.nih.gov/pmc/articles/PMC7171750/,False,0,1,False,False,False,False,False,False,False,False
The cyclic nucleotide-gated channel CNGC14 regulates root gravitropism in Arabidopsis thaliana.,https://www.ncbi.nlm.nih.gov/pmc/articles/PMC10414970/,False,0,0,False,False,False,False,False,False,False,False
Telomere length assessments of muscle stem cells in rodent and human skeletal muscle sections,https://www.ncbi.nlm.nih.gov/pmc/articles/PMC8450295/,False,0,3,False,False,False,True,False,False,False,False
Persistent NF-κB activation in muscle stem cells induces proliferation-independent telomere shortening,https://www.ncbi.nlm.nih.gov/pmc/articles/PMC8183356/,False,0,2,False,False,True,False,False,False,False,False
Piezo1 regulates the regenerative capacity of skeletal muscles via orchestration of stem cell morphological states.,https://www.ncbi.nlm.nih.gov/pmc/articles/PMC8932657/,False,0,3,False,False,True,False,False,False,False,False
"Impacts of radiation exposure, hindlimb unloading, and recovery on murine skeletal muscle cell telomere length.",https://www.ncbi.nlm.nih.gov/pmc/articles/PMC10504369/,False,0,3,False,False,False,False,False,False,False,False
Ethylene-induced flavonol accumulation in guard cells suppresses reactive oxygen species and modulates stomatal aperture,https://www.ncbi.nlm.nih.gov/pmc/articles/PMC3982735/,False,0,1,False,False,False,False,False,False,False,False
Transcriptional and Hormonal Regulation of Gravitropism of Woody Stems in Populus.,https://www.ncbi.nlm.nih.gov/pmc/articles/PMC4682325/,False,0,0,False,False,False,False,False,False,False,False
Endosidin2 targets conserved exocyst complex subunit EXO70 to inhibit exocytosis,https://www.ncbi.nlm.nih.gov/pmc/articles/PMC10264680/,False,0,0,False,False,False,False,False,False,False,False
"A conditional mutation in SCD1 reveals linkage between PIN protein trafficking, auxin transport, gravitropism, and lateral root initiation.",https://www.ncbi.nlm.nih.gov/pmc/articles/PMC7358545/,False,0,1,False,False,False,False,False,False,False,False
"A comprehensive SARS-CoV-2 and COVID-19 review, Part 1: Intracellular overdrive for SARS-CoV-2 infection.",https://www.ncbi.nlm.nih.gov/pmc/articles/PMC9108708/,False,0,1,False,False,False,False,False,False,False,False
Changes in nuclear shape and gene expression in response to simulated microgravity are LINC complex-dependent.,https://www.ncbi.nlm.nih.gov/pmc/articles/PMC7555797/,False,0,2,False,False,False,False,False,False,False,False
"Growth of Carnobacterium spp. from permafrost under low pressure, temperature, and anoxic atmosphere has implications for Earth microbes on Mars",https://www.ncbi.nlm.nih.gov/pmc/articles/PMC3545801/,False,0,0,False,False,True,False,False,False,False,False
Complete Genome Sequence of Carnobacterium gilichinskyi Strain WN1359T (DSM 27470T),https://www.ncbi.nlm.nih.gov/pmc/articles/PMC3869332/,False,0,0,False,False,False,False,False,False,False,False
"Exposure of Bacillus subtilis to low pressure (5 kilopascals) induces several global regulons, including those involved in the SigB-mediated general stress response",https://www.ncbi.nlm.nih.gov/pmc/articles/PMC4135744/,False,0,2,False,False,False,False,False,False,False,False
"Resistance of Bacillus subtilis Spore DNA to Lethal Ionizing Radiation Damage Relies Primarily on Spore Core Components and DNA Repair, with Minor Effects of Oxygen Radical Detoxification",https://www.ncbi.nlm.nih.gov/pmc/articles/PMC3911009/,False,0,1,False,False,False,False,False,False,False,False
Cultivation of Staphylococcus epidermidis in the human spaceflight environment leads to alterations in the frequency and spectrum of spontaneous rifampicin-resistance mutations in the rpoB gene,https://www.ncbi.nlm.nih.gov/pmc/articles/PMC4923109/,False,0,2,False,False,True,True,False,False,False,False
Experimental Evolution of Bacillus subtilis,https://www.ncbi.nlm.nih.gov/pmc/articles/PMC11673879/,False,0,0,False,False,False,False,False,False,False,False
Cultivation in space flight produces minimal alterations in the susceptibility of Bacillus subtilis cells to 72 different antibiotics and growth-inhibiting compounds,https://www.ncbi.nlm.nih.gov/pmc/articles/PMC5648920/,False,0,1,False,False,True,False,False,False,False,False
Alterations in the Spectrum of Spontaneous Rifampicin-Resistance Mutations in the Bacillus subtilis rpoB Gene after Cultivation in the Human Spaceflight Environment,https://www.ncbi.nlm.nih.gov/pmc/articles/PMC5817088/,False,0,2,False,False,True,True,False,False,False,False
Mechanotransduction in Prokaryotes: A Possible Mechanism of Spaceflight Adaptation,https://www.ncbi.nlm.nih.gov/pmc/articles/PMC7825584/,False,0,1,False,False,False,False,False,False,False,False
Environmental dependence of competitive fitness in rifampin-resistant rpoB mutants of Bacillus subtilis.,https://www.ncbi.nlm.nih.gov/pmc/articles/PMC8904044/,False,0,0,False,False,False,False,False,False,False,False
Analysis of interactions of Salmonella type three secretion mutants with 3-D intestinal epithelial cells.,https://www.ncbi.nlm.nih.gov/pmc/articles/PMC3012082/,False,0,1,False,False,False,False,False,False,False,False
Organotypic 3D cell culture models: using the rotating wall vessel to study host-pathogen interactions.,https://www.ncbi.nlm.nih.gov/pmc/articles/PMC11088941/,False,0,1,False,False,False,False,True,False,False,False
Induction of attachment-independent biofilm formation and repression of Hfq expression by low-fluid-shear culture of Staphylococcus aureus,https://www.ncbi.nlm.nih.gov/pmc/articles/PMC3187170/,False,0,0,False,False,False,False,False,False,False,False
Characterization of the Salmonella enterica serovar Typhimurium ydcI gene which encodes a conserved DNA binding protein required for full acid stress resistance.,https://www.ncbi.nlm.nih.gov/pmc/articles/PMC3133089/,False,0,3,False,False,False,False,False,False,False,False
Evaluation of microorganisms cultured from injured and repressed tissue regeneration sites in endangered giant aquatic Ozark Hellbender salamanders.,https://www.ncbi.nlm.nih.gov/pmc/articles/PMC3242767/,False,0,2,False,False,True,False,False,False,False,False
Transcriptional and proteomic responses of Pseudomonas aeruginosa PAO1 to spaceflight conditions involve Hfq regulation and reveal a role for oxygen.,https://www.ncbi.nlm.nih.gov/pmc/articles/PMC3067220/,False,0,1,False,False,False,False,False,False,False,False
New insights into the bacterial fitness-associated mechanisms revealed by the characterization of large plasmids of an avian pathogenic E. coli,https://www.ncbi.nlm.nih.gov/pmc/articles/PMC3251573/,False,0,0,False,False,False,False,False,False,False,False
Lack of norovirus replication and histo-blood group antigen expression in 3-dimensional intestinal epithelial cells,https://www.ncbi.nlm.nih.gov/pmc/articles/PMC3647661/,False,0,1,False,False,False,False,False,False,False,False
Conservation of the low-shear modeled microgravity response in Enterobacteriaceae and analysis of the trp genes in this response.,https://www.ncbi.nlm.nih.gov/pmc/articles/PMC4085587/,False,0,2,False,False,False,False,False,False,False,False
