Title,Link,has_ai_ml,ai_keywords_count,bio_keywords_count,organism_mice,organism_mouse,organism_rat,organism_human,organism_cell culture,organism_drosophila,organism_elegans,organism_plant
Effects of spaceflight and ground recovery on mesenteric artery and vein constrictor properties in mice.,https://www.ncbi.nlm.nih.gov/pmc/articles/PMC4050424/,False,0,1,True,False,False,False,False,False,False,False
"Spaceflight-induced alterations in cerebral artery vasoconstrictor, mechanical, and structural properties: Implications for elevated cerebral perfusion and intracranial pressure",https://www.ncbi.nlm.nih.gov/pmc/articles/PMC3659353/,False,0,1,False,False,True,False,False,False,False,False
Exercise training augments regional bone and marrow blood flow during exercise.,https://www.ncbi.nlm.nih.gov/pmc/articles/PMC4169763/,False,0,1,False,False,False,False,False,False,False,False
Effects of Skeletal Unloading on the Vasomotor Properties of the Rat Femur Principal Nutrient Artery,https://www.ncbi.nlm.nih.gov/pmc/articles/PMC4398884/,False,0,0,False,False,True,False,False,False,False,False
Type 2 diabetes alters bone and marrow blood flow and vascular control mechanisms in the ZDF rat.,https://www.ncbi.nlm.nih.gov/pmc/articles/PMC4379453/,False,0,1,False,False,True,False,False,False,False,False
Spaceflight on the Bion-M1 biosatellite alters cerebral artery vasomotor and mechanical properties in mice,https://www.ncbi.nlm.nih.gov/pmc/articles/PMC4385880/,False,0,1,True,False,False,False,False,False,False,False
Apollo Lunar Astronauts Show Higher Cardiovascular Disease Mortality: Possible Deep Space Radiation Effects on the Vascular Endothelium,https://www.ncbi.nlm.nih.gov/pmc/articles/PMC4964660/,False,0,1,False,False,False,False,False,False,False,False
Effects of age and exercise training on coronary microvascular smooth muscle phenotype and function,https://www.ncbi.nlm.nih.gov/pmc/articles/PMC5866446/,False,0,1,False,False,False,False,False,False,False,False
Impact of Spaceflight and Artificial Gravity on the Mouse Retina: Biochemical and Proteomic Analysis.,https://www.ncbi.nlm.nih.gov/pmc/articles/PMC6165321/,False,0,1,False,True,False,False,False,False,False,False
Simulated microgravity induces regionally distinct neurovascular and structural remodeling of skeletal muscle and cutaneous arteries in the rat,https://www.ncbi.nlm.nih.gov/pmc/articles/PMC7339929/,True,1,2,False,False,True,False,False,False,False,False
Spaceflight decelerates the epigenetic clock orchestrated with a global alteration in DNA methylome and transcriptome in the mouse retina,https://www.ncbi.nlm.nih.gov/pmc/articles/PMC8220224/,False,0,2,False,True,True,False,False,False,False,False
Development of otolith receptors in Japanese quail.,https://www.ncbi.nlm.nih.gov/pmc/articles/PMC2910419/,False,0,0,False,False,False,False,False,False,False,False
Spatial and temporal characteristics of vestibular convergence,https://www.ncbi.nlm.nih.gov/pmc/articles/PMC3166430/,False,0,0,False,False,False,False,False,False,False,False
Bone remodeling is regulated by inner ear vestibular signals,https://www.ncbi.nlm.nih.gov/pmc/articles/PMC6615562/,True,1,1,False,False,False,False,False,False,False,False
Simulated Microgravity Enhances Oligodendrocyte Mitochondrial Function and Lipid Metabolism,https://www.ncbi.nlm.nih.gov/pmc/articles/PMC7324008/,False,0,2,False,False,False,False,False,False,False,False
Human Neural Stem Cells Flown into Space Proliferate and Generate Young Neurons,https://www.ncbi.nlm.nih.gov/pmc/articles/PMC8412175/,False,0,3,False,False,True,True,False,False,False,False
Delayed Maturation of Oligodendrocyte Progenitors by Microgravity: Implications for Multiple Sclerosis and Space Flight,https://www.ncbi.nlm.nih.gov/pmc/articles/PMC10607959/,False,0,1,False,False,True,False,False,False,False,False
Space Microgravity Alters Neural Stem Cell Division: Implications for Brain Cancer Research on Earth and in Space,https://www.ncbi.nlm.nih.gov/pmc/articles/PMC9699585/,False,0,3,False,False,False,False,False,False,False,False
Oligodendrocyte Progenitors Display Enhanced Proliferation and Autophagy after Space Flight,https://www.ncbi.nlm.nih.gov/pmc/articles/PMC9953055/,False,0,0,False,False,True,False,False,False,False,False
Metabolomics profile of the secretome of space-flown oligodendrocytes.,https://www.ncbi.nlm.nih.gov/pmc/articles/PMC10528075/,False,0,0,False,False,False,False,False,False,False,False
Metabolomic profiling of the secretome from human neural stem cells flown into space.,https://www.ncbi.nlm.nih.gov/pmc/articles/PMC10813126/,False,0,1,False,False,False,True,False,False,False,False
"Strategies, research priorities, and challenges for the exploration of space beyond low-Earth orbit",https://www.ncbi.nlm.nih.gov/pmc/articles/PMC10390562/,False,0,0,False,False,True,False,False,False,False,False
Spaceflight Induces Specific Alterations in the Proteomes of Arabidopsis,https://www.ncbi.nlm.nih.gov/pmc/articles/PMC4290804/,False,0,1,False,False,True,False,False,False,False,False
The effect of spaceflight on the gravity-sensing auxin gradient of roots: GFP reporter gene microscopy on orbit.,https://www.ncbi.nlm.nih.gov/pmc/articles/PMC5515520/,False,0,2,False,False,False,False,False,False,False,False
Skewing in Arabidopsis roots involves disparate environmental signaling pathways.,https://www.ncbi.nlm.nih.gov/pmc/articles/PMC5286820/,False,0,0,False,False,True,False,False,False,False,False
"Data for characterization of SALK_084889, a T-DNA insertion line of Arabidopsis thaliana",https://www.ncbi.nlm.nih.gov/pmc/articles/PMC5470433/,False,0,0,False,False,False,False,False,False,False,False
Genetic dissection of the Arabidopsis spaceflight transcriptome: Are some responses dispensable for the physiological adaptation of plants to spaceflight?,https://www.ncbi.nlm.nih.gov/pmc/articles/PMC5491145/,False,0,3,False,False,False,False,False,False,False,True
Phenotypic characterization of an Arabidopsis T- DNA insertion line SALK_063500,https://www.ncbi.nlm.nih.gov/pmc/articles/PMC5996828/,False,0,0,False,False,False,False,False,False,False,False
Utilization of single‐image normalized difference vegetation index (SI‐NDVI) for early plant stress detection,https://www.ncbi.nlm.nih.gov/pmc/articles/PMC6201722/,False,0,1,False,False,False,False,False,False,False,True
Comparing RNA-Seq and microarray gene expression data in two zones of the Arabidopsis root apex relevant to spaceflight.,https://www.ncbi.nlm.nih.gov/pmc/articles/PMC6240453/,False,0,2,False,False,False,False,False,False,False,False
Spaceflight-induced alternative splicing during seedling development in Arabidopsis thaliana.,https://www.ncbi.nlm.nih.gov/pmc/articles/PMC6447593/,False,0,1,False,False,False,False,False,False,False,False
The Plant Health Monitoring System of the EDEN ISS Space Greenhouse in Antarctica during the 2018 experiment phase,https://www.ncbi.nlm.nih.gov/pmc/articles/PMC7264257/,False,0,0,False,False,False,False,False,False,False,True
Root skewing-associated genes impact the spaceflight response of Arabidopsis thaliana.,https://www.ncbi.nlm.nih.gov/pmc/articles/PMC7064724/,False,0,2,False,False,False,False,False,False,False,False
Articular cartilage and sternal fibrocartilage respond differently to extended microgravity.,https://www.ncbi.nlm.nih.gov/pmc/articles/PMC6379395/,False,0,1,False,False,False,False,False,False,False,False
Host-microbe interactions in microgravity: assessment and implications.,https://www.ncbi.nlm.nih.gov/pmc/articles/PMC4187166/,False,0,1,False,False,False,False,False,False,False,False
Environmental cues and symbiont microbe-associated molecular patterns function in concert to drive the daily remodelling of the crypt-cell brush border of the Euprymna scolopes light organ,https://www.ncbi.nlm.nih.gov/pmc/articles/PMC5219934/,False,0,1,False,False,False,False,False,False,False,False
Symbiotic organs shaped by distinct modes of genome evolution in cephalopods.,https://www.ncbi.nlm.nih.gov/pmc/articles/PMC6386654/,False,0,0,False,False,False,False,False,False,False,False
Modeled microgravity alters lipopolysaccharide and outer membrane vesicle production of the beneficial symbiont Vibrio fischeri,https://www.ncbi.nlm.nih.gov/pmc/articles/PMC7940393/,False,0,1,False,False,False,False,False,False,False,False
Emergence of novel cephalopod gene regulation and expression through large-scale genome reorganization,https://www.ncbi.nlm.nih.gov/pmc/articles/PMC9023564/,False,0,1,False,False,False,False,False,False,False,False
Modeled microgravity alters apoptotic gene expression and caspase activity in the squid-vibrio symbiosis,https://www.ncbi.nlm.nih.gov/pmc/articles/PMC9389742/,False,0,2,False,False,False,False,False,False,False,False
In vitro generation of mechanically functional cartilage grafts based on adult human stem cells and 3D-woven poly(epsilon-caprolactone) scaffolds,https://www.ncbi.nlm.nih.gov/pmc/articles/PMC2824534/,False,0,2,False,False,True,True,False,False,False,False
Chondrogenesis and mineralization during in vitro culture of human mesenchymal stem cells on three-dimensional woven scaffolds,https://www.ncbi.nlm.nih.gov/pmc/articles/PMC2991213/,False,0,2,False,False,False,True,False,False,False,False
Microbiome metadata standards: Report of the National Microbiome Data Collaborative's workshop and follow-on activities.,https://www.ncbi.nlm.nih.gov/pmc/articles/PMC8269219/,False,0,0,False,False,True,False,False,False,False,False
Spaceflight alters host-gut microbiota interactions,https://www.ncbi.nlm.nih.gov/pmc/articles/PMC11362537/,False,0,1,False,False,False,False,False,False,False,False
Asparagine biosynthesis as a mechanism of increased host lethality induced by Serratia marcescens in simulated microgravity environments,https://www.ncbi.nlm.nih.gov/pmc/articles/PMC9111996/,False,0,1,False,False,True,False,False,False,False,False
Comparative genomic analysis of Cohnella hashimotonis sp. nov. isolated from the International Space Station.,https://www.ncbi.nlm.nih.gov/pmc/articles/PMC10308117/,False,0,0,False,False,True,False,False,False,False,False
Characterization of metagenome-assembled genomes from the International Space Station,https://www.ncbi.nlm.nih.gov/pmc/articles/PMC10233975/,False,0,0,False,False,False,False,False,False,False,False
Biocontrol in built environments to reduce pathogen exposure and infection risk.,https://www.ncbi.nlm.nih.gov/pmc/articles/PMC10848226/,False,0,0,False,False,False,False,False,False,False,False
Extracellular nucleotides elicit cytosolic free calcium oscillations in Arabidopsis.,https://www.ncbi.nlm.nih.gov/pmc/articles/PMC3329368/,False,0,1,False,False,False,False,False,False,False,False
"Calcium, mechanical signaling, and tip growth",https://www.ncbi.nlm.nih.gov/pmc/articles/PMC12008199/,False,0,0,False,False,False,False,False,False,False,False
Gravitropism and mechanical signaling in plants.,https://www.ncbi.nlm.nih.gov/pmc/articles/PMC12008199/,False,0,0,False,False,False,False,False,False,False,True
"Salt stress-induced Ca2+ waves are associated with rapid, long-distance root-to-shoot signaling in plants.",https://www.ncbi.nlm.nih.gov/pmc/articles/PMC4035928/,False,0,1,False,False,False,False,False,False,False,True
Gravitropic signaling in plants,https://www.ncbi.nlm.nih.gov/pmc/articles/PMC12008199/,False,0,0,False,False,False,False,False,False,False,True
Wortmannin-induced vacuole fusion enhances amyloplast dynamics in Arabidopsis zigzag1 hypocotyls.,https://www.ncbi.nlm.nih.gov/pmc/articles/PMC5181587/,False,0,0,False,False,False,False,False,False,False,False
A ROS-assisted calcium wave dependent on AtRBOHD and TPC1 propagates the systemic response to salt stress in Arabidopsis roots,https://www.ncbi.nlm.nih.gov/pmc/articles/PMC4936552/,False,0,1,False,False,False,False,False,False,False,False
"ROS, calcium and electric signals: Key mediators of rapid systemic signaling in plants",https://www.ncbi.nlm.nih.gov/pmc/articles/PMC7610290/,False,0,0,False,False,False,False,False,False,False,True
Real-time In Vivo Recording of Arabidopsis Calcium Signals During Insect Feeding Using a Fluorescent Biosensor,https://www.ncbi.nlm.nih.gov/pmc/articles/PMC5614317/,False,0,0,False,False,False,False,False,False,False,False
"Orchestrating rapid long-distance signaling in plants with Ca2+ , ROS, and electrical signals",https://www.ncbi.nlm.nih.gov/pmc/articles/PMC5677518/,False,0,0,False,False,True,False,False,False,False,True
"Glutamate triggers long-distance, calcium-based plant defense signaling.",https://www.ncbi.nlm.nih.gov/pmc/articles/PMC11850895/,False,0,0,False,False,False,False,False,False,False,True
Test of Arabidopsis Space Transcriptome: A discovery environment to explore multiple plant biology spaceflight experiments.,https://www.ncbi.nlm.nih.gov/pmc/articles/PMC7076552/,False,0,1,False,False,False,False,False,False,False,True
Tonoplast-localized Ca2+ pumps regulate Ca2+ signals during pattern-triggered immunity in Arabidopsis thaliana.,https://www.ncbi.nlm.nih.gov/pmc/articles/PMC7414185/,False,0,0,False,False,False,False,False,False,False,False
The fast and the furious: Rapid long-range signaling in plants.,https://www.ncbi.nlm.nih.gov/pmc/articles/PMC8133610/,False,0,0,False,False,False,False,False,False,False,True
Rad-Bio-App: A discovery environment for biologists to explore spaceflight-related radiation exposures,https://www.ncbi.nlm.nih.gov/pmc/articles/PMC8113475/,False,0,2,False,False,False,False,False,False,False,False
The vacuolar H+/Ca transporter CAX1 participates in submergence and anoxia stress responses.,https://www.ncbi.nlm.nih.gov/pmc/articles/PMC9706465/,False,0,1,False,False,False,False,False,False,False,False
Meta-analysis of the space flight and microgravity response of the Arabidopsis plant transcriptome,https://www.ncbi.nlm.nih.gov/pmc/articles/PMC10027818/,False,0,1,False,False,False,False,False,False,False,True
"Low-dose, ionizing radiation and age-related changes in skeletal microarchitecture",https://www.ncbi.nlm.nih.gov/pmc/articles/PMC3337602/,False,0,1,False,False,False,False,False,False,False,False
Ionizing Radiation Stimulates Expression of Pro-Osteoclastogenic Genes in Marrow and Skeletal Tissue,https://www.ncbi.nlm.nih.gov/pmc/articles/PMC4490751/,False,0,3,False,False,False,False,False,False,False,False
Preservation of Multiple Mammalian Tissues to Maximize Science Return from Ground Based and Spaceflight Experiments,https://www.ncbi.nlm.nih.gov/pmc/articles/PMC5132293/,False,0,2,False,False,False,False,False,False,False,False
Hindlimb Unloading: Rodent Analog for Microgravity,https://www.ncbi.nlm.nih.gov/pmc/articles/PMC11747068/,False,0,1,False,False,False,False,False,False,False,False
Redox Signaling and Its Impact on Skeletal and Vascular Responses to Spaceflight,https://www.ncbi.nlm.nih.gov/pmc/articles/PMC5666834/,False,0,1,False,False,False,False,False,False,False,False
Influence of social isolation during prolonged simulated weightlessness by hindlimb unloading,https://www.ncbi.nlm.nih.gov/pmc/articles/PMC6753329/,False,0,0,False,False,False,False,False,False,False,False
Validation of a new Rodent experimental System to investigate consequences of Long Duration Space Habitation,https://www.ncbi.nlm.nih.gov/pmc/articles/PMC7012842/,False,0,0,False,False,True,False,False,False,False,False
Skeletal tissue regulation by catalase over-expression in mitochondria,https://www.ncbi.nlm.nih.gov/pmc/articles/PMC4405755/,False,0,1,False,False,False,False,False,False,False,False
Overexpression of catalase in mitochondria mitigates changes in hippocampal cytokine expression following simulated microgravity and isolation.,https://www.ncbi.nlm.nih.gov/pmc/articles/PMC8260663/,False,0,1,False,False,False,False,False,False,False,False
An extensive allelic series of Drosophila kae1 mutants reveals diverse and tissue-specific requirements for t6A biogenesis,https://www.ncbi.nlm.nih.gov/pmc/articles/PMC4647464/,False,0,2,False,False,False,False,False,True,False,False
Novel Organelles with Elements of Bacterial and Eukaryotic Secretion Systems Weaponize Parasites of Drosophila,https://www.ncbi.nlm.nih.gov/pmc/articles/PMC5659752/,False,0,0,False,False,False,False,False,True,False,False
A combined computational strategy of sequence and structural analysis predicts the existence of a functional eicosanoid pathway in Drosophila melanogaster.,https://www.ncbi.nlm.nih.gov/pmc/articles/PMC6372189/,True,1,0,False,False,True,False,False,True,False,False
Immune suppressive extracellular vesicle proteins of Leptopilina heterotoma are encoded in the wasp genome.,https://www.ncbi.nlm.nih.gov/pmc/articles/PMC6945029/,False,0,3,False,False,False,False,False,False,False,False
Spaceflight and simulated microgravity conditions increase virulence of Serratia marcescens in the Drosophila melanogaster infection model.,https://www.ncbi.nlm.nih.gov/pmc/articles/PMC7000411/,False,0,2,False,False,True,False,False,True,False,False
A parasitoid wasp of Drosophila employs preemptive and reactive strategies to deplete its host's blood cells,https://www.ncbi.nlm.nih.gov/pmc/articles/PMC8191917/,False,0,1,False,False,True,False,False,True,False,False
In Silico Analysis of a Drosophila Parasitoid Venom Peptide Reveals Prevalence of the Cation–Polar–Cation Clip Motif in Knottin Proteins,https://www.ncbi.nlm.nih.gov/pmc/articles/PMC9865768/,False,0,1,False,False,False,False,False,True,False,False
Drosophila parasitoids go to space: Unexpected effects of spaceflight on hosts and their parasitoids.,https://www.ncbi.nlm.nih.gov/pmc/articles/PMC10797188/,False,0,1,False,False,False,False,False,True,False,False
Drosophila parasitoids go to space: Unexpected effects of spaceflight on hosts and their parasitoids,https://www.ncbi.nlm.nih.gov/pmc/articles/PMC10797188/,False,0,1,False,False,False,False,False,True,False,False
Simultaneous exposure of cultured human lymphoblastic cells to simulated microgravity and radiation increases chromosome aberrations,https://www.ncbi.nlm.nih.gov/pmc/articles/PMC7555395/,False,0,3,False,False,True,True,False,False,False,False
Genes required for survival in microgravity revealed by genome-wide yeast deletion collections cultured during spaceflight.,https://www.ncbi.nlm.nih.gov/pmc/articles/PMC4309212/,False,0,3,False,False,False,False,False,False,False,False
Physical Forces Modulate Oxidative Status and Stress Defense Meditated Metabolic Adaptation of Yeast Colonies: Spaceflight and Microgravity Simulations,https://www.ncbi.nlm.nih.gov/pmc/articles/PMC6560652/,False,0,3,False,False,False,False,False,False,False,False
Effects of space flight on mouse liver versus kidney: Gene pathway analyses.,https://www.ncbi.nlm.nih.gov/pmc/articles/PMC6321533/,False,0,1,False,True,False,False,False,False,False,False
Yeast in Space,https://www.ncbi.nlm.nih.gov/pmc/articles/PMC12040010/,False,0,0,False,False,False,False,False,False,False,False
Endocrine Effects of Space Flight,https://www.ncbi.nlm.nih.gov/pmc/articles/PMC11833055/,False,0,0,False,False,False,False,False,False,False,False
Role of shear stress on renal proximal tubular cells for nephrotoxicity assays,https://www.ncbi.nlm.nih.gov/pmc/articles/PMC9146534/,False,0,2,False,False,False,False,False,False,False,False
Bone hemodynamic responses to changes in external pressure.,https://www.ncbi.nlm.nih.gov/pmc/articles/PMC11492218/,False,0,1,False,False,False,False,False,False,False,False
Back pain in space and post-flight spine injury: Mechanisms and countermeasure development,https://www.ncbi.nlm.nih.gov/pmc/articles/PMC6339989/,False,0,0,False,False,False,False,False,False,False,False
Fifteen days of microgravity causes growth in calvaria of mice,https://www.ncbi.nlm.nih.gov/pmc/articles/PMC4110898/,False,0,1,True,False,False,False,False,False,False,False
Altered disc compression in children with idiopathic low back pain: an upright magnetic resonance imaging backpack study,https://www.ncbi.nlm.nih.gov/pmc/articles/PMC3947616/,False,0,0,False,False,False,False,False,False,False,False
Spaceflight-induced bone loss alters failure mode and reduces bending strength in murine spinal segments.,https://www.ncbi.nlm.nih.gov/pmc/articles/PMC5477841/,False,0,2,False,False,False,False,False,False,False,False
Spaceflight-associated vascular remodeling and gene expression in mouse calvaria.,https://www.ncbi.nlm.nih.gov/pmc/articles/PMC9139491/,True,1,2,False,True,False,False,False,False,False,False
"Exposure of Mycobacterium marinum to low-shear modeled microgravity: Effect on growth, the transcriptome and survival under stress.",https://www.ncbi.nlm.nih.gov/pmc/articles/PMC5515531/,False,0,2,False,False,False,False,False,False,False,False
Effects of mechanostimulation on gravitropism and signal persistence in flax roots.,https://www.ncbi.nlm.nih.gov/pmc/articles/PMC3258067/,False,0,0,False,False,False,False,False,False,False,False
Oxygen dependency of germinating Brassica seeds.,https://www.ncbi.nlm.nih.gov/pmc/articles/PMC10025027/,False,0,0,False,False,False,False,False,False,False,False
"Desiccation mitigates heat stress in the resurrection fern, Pleopeltis polypodioides",https://www.ncbi.nlm.nih.gov/pmc/articles/PMC7733933/,False,0,1,False,False,False,False,False,False,False,False
Transcription profile of auxin related genes during positively gravitropic hypocotyl curvature of Brassica rapa.,https://www.ncbi.nlm.nih.gov/pmc/articles/PMC9105288/,False,0,1,False,False,False,False,False,False,False,False
High-gradient magnetic fields and starch metabolism: Results from a space experiment.,https://www.ncbi.nlm.nih.gov/pmc/articles/PMC9617909/,False,0,1,False,False,False,False,False,False,False,False
Lipid rafts and plant gravisensitivity.,https://www.ncbi.nlm.nih.gov/pmc/articles/PMC9695138/,False,0,0,False,False,False,False,False,False,False,True
Expression and characterization of the bacterial mechanosensitive channel MscS in Xenopus laevis oocytes,https://www.ncbi.nlm.nih.gov/pmc/articles/PMC3503204/,False,0,0,False,False,False,False,False,False,False,False
United in Diversity: Mechanosensitive Ion Channels in Plants,https://www.ncbi.nlm.nih.gov/pmc/articles/PMC5896955/,False,0,0,False,False,False,False,False,False,False,True
Expressing and Characterizing Mechanosensitive Channels in Xenopus Oocytes,https://www.ncbi.nlm.nih.gov/pmc/articles/PMC4469364/,False,0,0,False,False,False,False,False,False,False,False
The ongoing search for the molecular basis of plant osmosensing,https://www.ncbi.nlm.nih.gov/pmc/articles/PMC4411250/,False,0,0,False,False,False,False,False,False,False,True
Plastid osmotic stress influences cell differentiation at the plant shoot apex.,https://www.ncbi.nlm.nih.gov/pmc/articles/PMC5047659/,False,0,2,False,False,False,False,False,False,False,True
Spaceflight-induced synaptic modifications within hair cells of the mammalian utricle.,https://www.ncbi.nlm.nih.gov/pmc/articles/PMC5454470/,False,0,2,False,False,False,False,False,False,False,False
Effects of angular frequency during clinorotation on mesenchymal stem cell morphology and migration,https://www.ncbi.nlm.nih.gov/pmc/articles/PMC5515506/,False,0,1,False,False,True,False,False,False,False,False
"The role of FGF-2 and BMP-2 in regulation of gene induction, cell proliferation and mineralization.",https://www.ncbi.nlm.nih.gov/pmc/articles/PMC3044105/,False,0,2,False,False,True,False,False,False,False,False
"Nutritional supplements, COX-2 and IGF-1 expression in men on active surveillance for prostate cancer.",https://www.ncbi.nlm.nih.gov/pmc/articles/PMC3002170/,False,0,0,False,False,False,False,False,False,False,False
To Infinity and Beyond! Human spaceflight and life science.,https://www.ncbi.nlm.nih.gov/pmc/articles/PMC6188462/,False,0,1,False,False,False,True,False,False,False,False
Hyperoxia inhibits T cell activation in mice,https://www.ncbi.nlm.nih.gov/pmc/articles/PMC11470607/,False,0,1,True,False,False,False,False,False,False,False
"Effects of gravitational mechanical unloading in endothelial cells: association between caveolins, inflammation and adhesion molecules",https://www.ncbi.nlm.nih.gov/pmc/articles/PMC3603133/,False,0,1,False,False,False,False,False,False,False,False
n-3 Polyunsaturated fatty acids supplementation in peripheral artery disease: the OMEGA-PAD trial,https://www.ncbi.nlm.nih.gov/pmc/articles/PMC6462350/,False,0,0,False,False,True,False,False,False,False,False
Molecular mechanisms underlying the enhanced functions of three-dimensional hepatocyte aggregates,https://www.ncbi.nlm.nih.gov/pmc/articles/PMC4012541/,False,0,0,False,False,False,False,False,False,False,False
Spaceflight alters expression of microRNA during T-cell activation,https://www.ncbi.nlm.nih.gov/pmc/articles/PMC4653058/,False,0,2,False,False,False,False,False,False,False,False
Spaceflight impairs antigen-specific tolerance induction in vivo and increases inflammatory cytokines.,https://www.ncbi.nlm.nih.gov/pmc/articles/PMC6137544/,False,0,1,False,False,False,False,False,False,False,False
"From cellular mechanotransduction to biologically inspired engineering: 2009 Pritzker Award Lecture, BMES Annual Meeting October 10, 2009.",https://www.ncbi.nlm.nih.gov/pmc/articles/PMC2913424/,False,0,1,False,False,False,False,False,False,False,False
Crewmember microbiome may influence microbial composition of ISS habitable surfaces,https://www.ncbi.nlm.nih.gov/pmc/articles/PMC7190111/,False,0,0,False,False,False,False,False,False,False,False
Sierra Nevada sweep: Metagenomic measurements of bioaerosols vertically distributed across the troposphere.,https://www.ncbi.nlm.nih.gov/pmc/articles/PMC7382458/,False,0,0,False,False,False,False,False,False,False,False
Draft Genome Sequences of Fungi Isolated from the International Space Station during the Microbial Tracking-2 Experiment,https://www.ncbi.nlm.nih.gov/pmc/articles/PMC8444978/,False,0,0,False,False,False,False,False,False,False,False
